bookID,title,authors,average_rating,isbn,isbn13,category
35258,Father of Frankenstein,Christopher Bram,4.1,0452273374,9780450000000.0,performing arts
17267,The Great Divorce,C.S. Lewis,4.28,0006280560,9790010000000.0,fiction
11295,The Group,Mary McCarthy,3.66,0451025016,9780450000000.0,fiction
12873,Rebecca,Daphne du Maurier/Sally Beauman,4.23,1844080382,9781840000000.0,fiction
4898,Blue Ocean Strategy: How to Create Uncontested Market Space and Make the Competition Irrelevant,W. Chan Kim/Renée Mauborgne,3.91,1591396190,9781590000000.0,business & economics
37343,My Wicked Pirate,Rona Sharon,3.9,0821780573,9780820000000.0,fiction
10666,The Ends Of The Earth: A Journey At The Dawn Of The 21st Century,Robert D. Kaplan,4.12,0679431489,9780680000000.0,current events
36086,The Ghost Map: The Story of London's Most Terrifying Epidemic—and How It Changed Science  Cities  and the Modern World,Steven Johnson,3.9,1594489254,9781590000000.0,
14566,Echo,Francesca Lia Block,3.87,0064407446,9780060000000.0,juvenile fiction
3985,The Amazing Adventures of Kavalier & Clay,Michael Chabon,4.18,0312282990,9780310000000.0,fiction
10013,Erläuterungen Zu Max Frisch  Homo Faber,Bernd Matzkowski,3.6,3804417833,9783800000000.0,
7131,The Count of Monte Cristo,Alexandre Dumas/Lorenzo Carcaterra,4.25,037576030X,9780380000000.0,fiction
18184,The Complete Theory Fun Factory: Music Theory Puzzles and Games for the Early Grades,Ian        Martin/Katie Elliott,5,0851621813,9780850000000.0,music theory
25118,Uncommon Ground: Rethinking the Human Place in Nature,William Cronon,4.16,0393315118,9780390000000.0,history
16776,I Dreamed I Married Perry Mason (A Cece Caruso Mystery  #1),Susan Kandel,3.47,0060581069,9780060000000.0,
3765,Octopussy & the Living Daylights (James Bond  #14),Ian Fleming,3.55,0142003298,9780140000000.0,humor
14945,Moments of Being: A Collection of Autobiographical Writing,Virginia Woolf/Jeanne Schulkind,4.26,0156619180,9780160000000.0,biography & autobiography
32779,The Aeneid (Verse Translation),Virgil/Rolfe Humphries,3.84,0024277800,9780020000000.0,
12349,My Year of Meats,Ruth Ozeki,3.96,0140280464,9780140000000.0,fiction
3769,The Dharma Bums,Jack Kerouac,3.92,0141184884,9780140000000.0,
23643,Faërie,J.R.R. Tolkien/Francis Ledoux,3.54,2266102710,9782270000000.0,
38905,Follow Your Heart's Vegetarian Soup Cookbook,Janice Cook Migliaccio,3.47,0880071311,9780880000000.0,
20552,Selected Speeches and Writings,Abraham Lincoln/Gore Vidal,4.22,0679737316,9780680000000.0,history
3316,Die Brücke über die Drina,Ivo Andrić/Ernst E. Jonas,4.33,3518399608,9783520000000.0,fiction
23265,Feminist Measures: Soundings in Poetry and Theory,Lynn Keller/Lynn Keller,4.4,0472064843,9780470000000.0,literary criticism
16131,The House of Morgan: An American Banking Dynasty and the Rise of Modern Finance,Ron Chernow,4.07,0802138292,9780800000000.0,business & economics
7006,Hamlet,William Shakespeare,4.02,1411400429,9781410000000.0,
28389,Marcel Proust: A Life,William C. Carter,4.33,0300094000,9780300000000.0,biography & autobiography
7757,Cliffsnotes on Beckett's Waiting for Godot and Other Plays,James Lamar Roberts/Jeffrey Fisher,3.67,0822013541,9780820000000.0,
25741,Collected Stories III: One Night in Brazil to The Death of Methuselah,Isaac Bashevis Singer/Ilan Stavans,4.61,1931082634,9781930000000.0,fiction
40859,Inside Himalaya,Basil Pao/Michael Palin,4,0297843702,9780300000000.0,travel
16920,Hidden World,Graham Masterton,3.47,0727859625,9780730000000.0,fiction
22198,The Hunt for Zero Point: Inside the Classified World of Antigravity Technology,Nick Cook,4.12,0767906284,9780770000000.0,technology & engineering
37380,The Heart Is a Lonely Hunter,Carson McCullers,3.98,0618084746,9780620000000.0,
15428,Up in a Heaval (Xanth #26),Piers Anthony,3.83,0812574990,9780810000000.0,fiction
39149,What Angels Fear (Sebastian St. Cyr  #1),C.S. Harris,3.89,0451219716,9780450000000.0,
25725,Every Second Counts,Lance Armstrong/Sally Jenkins,3.52,0224064738,9780220000000.0,biography & autobiography
10147,The Complete Sherlock Holmes  Volume I,Arthur Conan Doyle/Kyle Freeman,4.49,1593080344,9781590000000.0,
1328,Phaedrus,Plato/C.J. Rowe,3.92,0140449744,9780140000000.0,language arts & disciplines
23788,Anton Chekhov's Selected Plays,Anton Chekhov/Laurence Senelick,4.01,0393924653,9780390000000.0,drama
13062,Skin Tight (Mick Stranahan  #1),Carl Hiaasen,3.96,0446695696,9780450000000.0,fiction
33514,The Elements of Style,William Strunk Jr./E.B. White,4.19,0205313426,9780210000000.0,foreign language study
37061,Filth,Irvine Welsh,3.73,0099284294,9780100000000.0,fiction
27001,The Well of Lost Plots (Thursday Next #3),Jasper Fforde,4.1,0143034359,9780140000000.0,fiction
8922,The Hound of the Baskervilles (Sherlock Holmes  #5),Arthur Conan Doyle/David Timson,4.11,9626343346,9789630000000.0,
37807,Caesar's Commentaries: On the Gallic War & On the Civil War,Gaius Julius Caesar/James H. Ford/W.A. McDevitte,4.12,0976072610,9780980000000.0,
19439,My Perfect Life (Confessions of a Teenage Drama Queen  #2),Dyan Sheldon,3.32,076362828X,9780760000000.0,
26131,The Classical World: An Epic History from Homer to Hadrian,Robin Lane Fox,3.91,0465024963,9780470000000.0,history
14236,Gould's Book of Fish: A Novel in Twelve Fish,Richard Flanagan,3.69,1843540703,9781840000000.0,fiction
11352,Sula,Toni Morrison,3.93,0099760010,9780100000000.0,fiction
22885,Not Just a Pretty Face: Dolls and Human Figurines in Alaska Native Cultures,Molly C. Lee/Angela J. Linn/Chase Hensel/James H. Barker,3.5,1889963852,9781890000000.0,
4397,The Grapes of Wrath,John Steinbeck/Robert DeMott/Mick Wiggins,3.96,0143039431,9780140000000.0,fiction
19353,The Evolution of the Gilgamesh Epic,Jeffrey H. Tigay,3.82,0865165467,9780870000000.0,literary criticism
30474,The Communist Manifesto,Karl Marx/Friedrich Engels/Gareth Stedman Jones,3.55,0140447571,9780140000000.0,political science
41712,Lost City (NUMA Files  #5),Clive Cussler/Paul Kemprecos,3.9,0425204197,9780430000000.0,fiction
16928,The Riverside Milton,John Milton/Roy C. Flannagan,4.26,0395809991,9780400000000.0,
32810,The Divine Comedy II: Purgatory,Dante Alighieri/Dorothy L. Sayers/C.W. Scott-Giles,4.02,0140440461,9780140000000.0,
28468,Fantastic Alice,Margaret Weis/Esther M. Friesner/Roger Zelazny/Bruce Holland Rogers/Robin Wayne Bailey/Janet Pack/Lawrence Schimel/Jody Lynn Nye/Janet Asimov/Lisa Mason/Jane Lindskold/Mickey Zucker Reichert/Lawrence Watt-Evans/Peter Crowther/Gary A. Braunbeck/Connie Hirsch/Tobin Larson/Kevin T. Stein,3.4,0441002536,9780440000000.0,
17513,Die Verschwundene Katze = The Missing Cat,Chris L. Demarest,4.14,2831557437,9782830000000.0,
816,Cryptonomicon,Neal Stephenson,4.25,0060512806,9780060000000.0,fiction
13651,The Dispossessed,Ursula K. Le Guin,4.22,0061054887,9780060000000.0,
40929,The Rise of Theodore Roosevelt,Edmund Morris,4.23,0375756787,9780380000000.0,biography & autobiography
43340,The Second Time Around,Mary Higgins Clark,3.75,0743412621,9780740000000.0,fiction
42099,Jimi Hendrix: The Complete Guide to His Music  (Complete Guide to the Music of...),Peter Doggett,4,1844494241,9781840000000.0,music
28294,A Void,Georges Perec/Gilbert Adair,3.8,1567922961,9781570000000.0,comics & graphic novels
4241,The Illuminati Papers,Robert Anton Wilson,3.83,1579510027,9781580000000.0,"body, mind & spirit"
12378,The People's Tycoon: Henry Ford and the American Century,Steven Watts,4.02,0375707255,9780380000000.0,biography & autobiography
29378,Practical Ethics,Peter Singer,4.05,052143971X,9780520000000.0,philosophy
27000,Lost in a Good Book (Thursday Next  #2),Jasper Fforde,4.14,0142004030,9780140000000.0,fiction
7011,A Midsummer Night's Dream,William Shakespeare/Roma Gill/B. Litt,3.94,0198321503,9780200000000.0,drama
26934,A Multitude of Sins,Richard Ford,3.75,037572656X,9780380000000.0,education
31995,鋼之鍊金術師 4,Hiromu Arakawa/荒川弘/方郁仁,4.55,9861146121,9789860000000.0,
9361,Atlas Shrugged,Ayn Rand,3.69,0525948929,9780530000000.0,philosophy
39724,Marsha Is Only a Flower (Marsha  #2),Barbara Bottner,3.82,0307263304,9780310000000.0,juvenile fiction
14948,A Writer's Diary,Virginia Woolf/Leonard Woolf,4.26,0156027917,9780160000000.0,biography & autobiography
16967,1632,Eric Flint,4.04,1416532811,9781420000000.0,fiction
7965,Homebody,Orson Scott Card,3.39,0061093998,9780060000000.0,fiction
1561,Three Plays by Aristophanes: Lysistrata/Women at the Thesmophoria/Assemblywomen,Aristophanes/Jeffrey Henderson,3.94,0415907446,9780420000000.0,fiction
1710,Confesiones de un chef,Anthony Bourdain,4.07,8466308954,9788470000000.0,cooks
12847,The Art of Dreaming,Carlos Castañeda,4.1,1855384272,9781860000000.0,fiction
38330,El Borbah,Charles Burns,3.94,1560976934,9781560000000.0,comics & graphic novels
34558,Real Ultimate Power: The Official Ninja Book,Robert  Hamburger,4,080652569X,9780810000000.0,humor
35959,The Bonesetter's Daughter,Amy Tan,3.99,0006550436,9780010000000.0,fiction
7946,Eddie's Valuable Property,Carolyn Haywood,4.09,0688320147,9780690000000.0,juvenile fiction
22932,Emma  Vol. 01,Kaoru Mori/森 薫,3.83,1401211321,9781400000000.0,comics & graphic novels
22197,Zero Debt: The Ultimate Guide to Financial Freedom,Lynnette Khalfani,3.74,1932450750,9781930000000.0,business & economics
8822,Earthly Powers,Anthony Burgess,4.16,0099468646,9780100000000.0,fiction
41649,Make Four Million Dollars by Next Thursday!,Stephen Manes/George Ulrich,3.68,0440413702,9780440000000.0,booksellers and bookselling
19686,Mission of Honor (Tom Clancy's Op-Center  #9),Jeff Rovin/Tom Clancy/Steve Pieczenik,3.91,0425186709,9780430000000.0,
30976,Moon of the Spider (Diablo  #4),Richard A. Knaak,3.95,0743471326,9780740000000.0,constitutions
4331,Dreamland (Dreamland  #1),Dale Brown/Jim DeFelice,3.9,0007109660,9780010000000.0,young adult fiction
1591,Lysistrata,Aristophanes/Sarah Ruden,3.85,0872206033,9780870000000.0,literary criticism
34301,Echoes,Maeve Binchy,3.8,0440122090,9780440000000.0,fiction
4075,In Search of Memory: The Emergence of a New Science of Mind,Eric R. Kandel,4.1,0393058638,9780390000000.0,psychology
35441,Star Wars: Clone Wars  Volume 8: The Last Siege  the Final Truth,John Ostrander/Jan Duursema/Dan Parsons,4.1,1593074824,9781590000000.0,comics & graphic novels
42040,Love Poems and Sonnets,William Shakespeare,4.34,0385017332,9780390000000.0,poetry
25347,Out of Egypt (Christ the Lord  #1),Anne Rice,3.58,0345436830,9780350000000.0,fiction
39763,The Mystical Poems of Rumi 1: First Selection  Poems 1-200,Rumi/A.J. Arberry,4.28,0226731510,9780230000000.0,
42002,Millie's Fling,Jill Mansell,3.75,0747264864,9780750000000.0,fiction
44936,Refactoring: Improving the Design of Existing Code,Martin Fowler/Kent Beck/Don Roberts/Erich Gamma,4.24,0201485672,9780200000000.0,computers
3581,Sherlock Holmes: The Complete Novels and Stories  Volume I,Arthur Conan Doyle,4.47,0553212419,9780550000000.0,fiction
41702,The Navigator (NUMA Files  #7),Clive Cussler/Paul Kemprecos,3.94,0399154191,9780400000000.0,fiction
1536,Sophocles II: Ajax/Women of Trachis/Electra/Philoctetes (Complete Greek Tragedies 4),Sophocles/David Grene/Richmond Lattimore/John Moore/Michael Jameson,4.14,0226307867,9780230000000.0,fiction
40989,I Sold My Soul on Ebay: Viewing Faith Through an Atheist's Eyes,Hemant Mehta/Rob Bell,3.54,1400073472,9781400000000.0,
15714,Le mythe de Sisyphe,Albert Camus,4.15,2070322882,9782070000000.0,philosophy
24149,Around the World in 8 1/2 Days (Judy Moody #7),Megan McDonald/Peter H. Reynolds,4.15,0763628328,9780760000000.0,juvenile fiction
11656,Rabbit Angstrom: The Four Novels,John Updike,4.26,0679444599,9780680000000.0,fiction
10982,Selected Short Stories,William Faulkner,4.09,0679424784,9780680000000.0,fiction
43220,On Populist Reason,Ernesto Laclau,4.04,1859846513,9781860000000.0,political science
42883,Bill Bryson: The Complete Notes,Bill Bryson,4.09,038560131X,9780390000000.0,
21683,Prayers for Rain (Kenzie & Gennaro  #5),Dennis Lehane,4.09,0380730367,9780380000000.0,fiction
14063,The Legend of the Poinsettia,Tomie dePaola,4.19,0698115678,9780700000000.0,christmas
41506,The Autobiography of Andrew Carnegie and the Gospel of Wealth,Andrew Carnegie/Gordon Hutner,3.98,0451530381,9780450000000.0,biography & autobiography
39000,Six Frigates: The Epic History of the Founding of the U. S. Navy,Ian W. Toll,4.32,0393058476,9780390000000.0,history
31177,Morgan's Passing,Anne Tyler,3.78,0449911721,9780450000000.0,fiction
12961,Much Ado about Nothing (Oxford School Shakespeare),William Shakespeare/Roma Gill,4.07,0198320566,9780200000000.0,juvenile nonfiction
30250,Sensual Phrase  Vol. 17,Mayu Shinjō,4.24,1421505622,9781420000000.0,
14427,The spire  William Golding : notes,Steve Eddy,3.6,1405835648,9781410000000.0,
34444,Doctor Faustus,Thomas Mann/T.J. Reed/H.T. Lowe-Porter,4.08,0679409963,9780680000000.0,authors
45121,The Echo,Minette Walters,3.63,0515122564,9780520000000.0,fiction
1431,Veronika Decides to Die,Paulo Coelho/Margaret Jull Costa/Kâmuran Şipal,3.7,0061124265,9780060000000.0,fiction
6524,How to Write a Damn Good Novel: A Step-by-Step No Nonsense Guide to Dramatic Storytelling,James N. Frey,3.86,0312010443,9780310000000.0,language arts & disciplines
33195,Shakespeare's Romeo and Juliet,William Shakespeare/Karin Jacobson/Sidney Lamb,3.74,0764585746,9780760000000.0,drama
10574,The Colorado Kid,Stephen King,3.32,0843955848,9780840000000.0,comics & graphic novels
22035,Fools Die,Mario Puzo,3.72,0451160193,9780450000000.0,fiction
24249,A Cavern of Black Ice (Sword of Shadows  #1),J.V. Jones,3.87,076534551X,9780770000000.0,fiction
32456,Darkfall,Dean Koontz,3.82,0425214591,9780430000000.0,fiction
6115,Siddhartha,Hermann Hesse/Joachim Neugroschel/Ralph Freedman,4.02,0142437182,9780140000000.0,fiction
13666,Wonderful Alexander and the Catwings,Ursula K. Le Guin/S.D. Schindler,4.13,053106851X,9780530000000.0,
32584,Mysteries,Knut Hamsun/Sverre Lyngstad,4.09,0141186186,9780140000000.0,literary criticism
27861,Data Structures and Algorithms in C++,Adam Drozdek,3.8,0534375979,9780530000000.0,computers
7996,Redwall (Redwall  #1),Brian Jacques,4.12,1862301387,9781860000000.0,juvenile fiction
8077,Animales No Se Visten  Los (Animals Should Definitely Not Wear Clothing) with CD,Judi Barrett/Ron Barrett,4.11,1595191356,9781600000000.0,
8601,Talk to the Hand: The Utter Bloody Rudeness of Everyday Life,Lynne Truss,3.33,1861979339,9781860000000.0,humor
3798,The River,Rumer Godden,3.95,0330489992,9780330000000.0,bengal (india)
3743,Harriet Spies Again (Harriet the Spy Adventures  #1),Helen Ericson,3.84,0440416884,9780440000000.0,juvenile fiction
39103,Mozart's Don Giovanni (the Dover Opera Libretto Series),Wolfgang Amadeus Mozart/Lorenzo Da Ponte/Ellen H. Bleiler,3.94,0486249441,9780490000000.0,music
31247,A Christmas Carol and Other Christmas Books,Charles Dickens/Robert Douglas-Fairhurst,3.96,0192806947,9780190000000.0,literary criticism
11372,Babbitt,Sinclair Lewis,3.66,0486431673,9780490000000.0,fiction
19560,The Italians: A Full-Length Portrait Featuring Their Manners and Morals,Luigi Barzini/Joan Emerson,3.83,0684825007,9780680000000.0,
12807,The Crazed,Ha Jin,3.5,0434010537,9780430000000.0,fiction
3359,Angle of Repose,Wallace Stegner/Jackson J. Benson,4.27,0141185473,9780140000000.0,fiction
16996,Underworld Unleashed,Mark Waid/Scott Peterson/Howard Porter/Dennis Janke/Phil Jimenez/J.H. Williams III/John Stokes/Mick Gray/Dan           Green,3.12,1563894475,9781560000000.0,
32709,Now and on Earth,Jim Thompson/Stephen King,3.7,0679740139,9780680000000.0,biography & autobiography
23573,The Perfect London Walk,Roger Ebert/Daniel Curley/Jack Lane,4.26,0836279298,9780840000000.0,performing arts
5713,If I Die In A Combat Zone,Tim O'Brien,3.95,0586087990,9780590000000.0,biography & autobiography
7869,The Bourne Identity (Jason Bourne  #1),Robert Ludlum,4.02,0752864327,9780750000000.0,fiction
8765,I Feel Bad About My Neck: And Other Thoughts on Being a Woman,Nora Ephron,3.69,0307264556,9780310000000.0,humor
38333,Black Hole,Charles Burns,3.84,037542380X,9780380000000.0,graphic novels
44481,The Last Eyewitness: The Final Week,Chris Seay/Rob Pepper/Brian D. McLaren,3.65,0529123452,9780530000000.0,bibles
24028,"Dirty Italian: Everyday Slang from ""What's Up?"" to ""F*%# Off!""",Gabrielle Ann Euvino/Lindsay Mack,4,1569755663,9781570000000.0,
13446,El retrato de Rose Madder,Stephen King/Bettina Blanch Tyroller,3.7,0307376583,9780310000000.0,spain
38500,Women,Charles Bukowski,3.86,0061177598,9780060000000.0,fiction
26214,Big Anthony and the Magic Ring,Tomie dePaola,4.1,0156119072,9780160000000.0,juvenile fiction
3409,Temptations,Otis Williams/Patricia Romanowski,4.19,0815412185,9780820000000.0,biography & autobiography
16669,China and Japan (Myths and Legends),Donald A. Mackenzie,3.52,0517604469,9780520000000.0,history
22196,Zero: The Biography of a Dangerous Idea,Charles Seife,3.96,0285635948,9780290000000.0,mathematics
16689,Citizen of the Galaxy,Robert A. Heinlein,3.99,1416505520,9781420000000.0,fiction
19469,The Face on the Milk Carton (Janie Johnson  #1),Caroline B. Cooney,3.73,038532328X,9780390000000.0,"comic books, strips, etc"
32075,The Woman Who Rode Away and Other Stories,D.H. Lawrence/Christa Jansohn,3.49,0521294304,9780520000000.0,
31095,Lila's Child: An Inquiry into Quality,Robert M. Pirsig/Dan Glover,3.58,1403356203,9781400000000.0,
27724,Mirror in the Mirror,Michael Ende/J. Maxwell Brownjohn,4.14,067080682X,9780670000000.0,book industries and trade
25332,Ju-on Volume 1 (呪怨  #1),Kei Ohishi/Joe Swift,3.82,159582071X,9781600000000.0,
18486,Frankenstein Makes a Sandwich,Adam Rex,4.21,0152057668,9780150000000.0,juvenile nonfiction
33137,Floating in My Mother's Palm,Ursula Hegi/John Collier/Francine Kass,3.82,0684854759,9780680000000.0,fiction
37553,Sense and Sensibility,Jane Austen/Claire Lamont/James Kinsley,4.07,0192804782,9780190000000.0,fiction
39801,The White Lioness (Kurt Wallander  #3),Henning Mankell/Laurie Thompson,3.84,0099464691,9780100000000.0,fiction
12828,How to Be Alone,Jonathan Franzen,3.59,0007153589,9780010000000.0,literary criticism
35050,Trial By Fire,D.W. Buffa,3.76,0451412125,9780450000000.0,american literature
42155,Something Blue (Darcy & Rachel  #2),Emily Giffin,3.93,0312323867,9780310000000.0,fiction
2348,An Introduction to Old Norse,E.V. Gordon/A.R. Taylor,4.1,0198111843,9780200000000.0,
14680,The Charterhouse of Parma,Stendhal/Richard Howard/Robert Andrew Parker,3.82,0679783180,9780680000000.0,fiction
17688,The Metamorphosis  In the Penal Colony  and Other Stories: The Great Short Works of Franz Kafka,Franz Kafka,4.04,0684800705,9780680000000.0,fiction
10701,Birds Without Wings,Louis de Bernières,4.16,0436205491,9780440000000.0,fiction
36137,Bad Dreams,Kim Newman,3.16,0786702273,9780790000000.0,literary criticism
4162,Read for Your Life: 11 Ways to Better Yourself Through Books,Pat Williams/Peggy Matthews Rose,3.7,0757305458,9780760000000.0,language arts & disciplines
20867,Line of Control (Tom Clancy's Op-Center  #8),Jeff Rovin/Tom Clancy/Steve Pieczenik,3.86,0425180050,9780430000000.0,
43378,A Long Short War: The Postponed Liberation of Iraq,Christopher Hitchens,3.75,0452284988,9780450000000.0,history
43244,High Performance MySQL: Optimization  Backups  Replication & Load Balancing,Jeremy D. Zawodny/Derek J. Balling,4.23,0596003064,9780600000000.0,computers
5129,Brave New World,Aldous Huxley,3.99,0060929871,9780060000000.0,"short stories, west indian (english)"
8698,So Long  and Thanks for All the Fish (Hitchhiker's Guide to the Galaxy  #4),Douglas Adams,4.09,0330491237,9780330000000.0,"dent, arthur (fictitious character)"
28054,River of Shadows: Eadweard Muybridge and the Technological Wild West,Rebecca Solnit,4.15,0142004103,9780140000000.0,biography & autobiography
18217,Rameau's Nephew / D'Alembert's Dream,Denis Diderot/Leonard Tancock,3.67,0140441735,9780140000000.0,fiction
20694,Julius  the Baby of the World,Kevin Henkes,4.28,0688143881,9780690000000.0,juvenile fiction
21191,The Time Travelers: Volume One,Caroline B. Cooney,3.94,0553494805,9780550000000.0,young adult fiction
14786,Chosen But Free,Norman L. Geisler,3.31,0764225219,9780760000000.0,arminianism
537,The Lovely Bones,Alice Sebold,3.81,0330485385,9780330000000.0,fiction
38463,If Beale Street Could Talk,James Baldwin,4.23,0307275930,9780310000000.0,fiction
6980,The Dance of the Dissident Daughter: A Woman's Journey from Christian Tradition to the Sacred Feminine,Sue Monk Kidd,3.95,0061144908,9780060000000.0,
27695,Nine Coaches Waiting,Mary  Stewart/Sandra Brown,4.03,1556526180,9781560000000.0,
22431,Created in Darkness by Troubled Americans: The Best of McSweeney's Humor Category,Dave Eggers/Kevin Shay/Lee Epstein/Suzanne Kleid/McSweeney's Publishing,3.75,1400076854,9781400000000.0,
1243,A Million Little Lies,James Pinocchio/Pablo Fenjves,3.41,0061171468,9780060000000.0,humor
8810,A Clockwork Orange,Anthony Burgess/Blake Morrison,3.99,0141182601,9780140000000.0,fiction
12113,Six Characters in Search of an Author and Other Plays,Luigi Pirandello/Mark Musa,3.95,014018922X,9780140000000.0,
16431,Sole Survivor,Dean Koontz,3.78,0553589490,9780550000000.0,fiction
10108,The Autobiography of Henry VIII: With Notes by His Fool  Will Somers,Margaret George,4.26,0312194390,9780310000000.0,fiction
41703,Golden Buddha (Oregon Files  #1),Clive Cussler/Craig Dirgo,3.9,0141010312,9780140000000.0,fiction
30542,The Art of the Ridiculous Sublime: On David Lynch's Lost Highway,Slavoj Žižek/Marek Wieczorek,3.72,0295979259,9780300000000.0,literary criticism
31996,鋼之鍊金術師 9,Hiromu Arakawa/荒川弘/方郁仁,4.57,9861156526,9789860000000.0,
17112,Things Fall Apart: An Adapted Classic,Chinua Achebe,3.66,0130235016,9780130000000.0,
43328,Rage of Angels,Sidney Sheldon,3.93,0006178731,9780010000000.0,fiction
10760,Sword and Shield,John Terra,4,1560764988,9781560000000.0,dungeons and dragons (game)
5308,The Pearl,John Steinbeck,3.46,0142000698,9780140000000.0,fiction
5985,An Episode of Sparrows,Rumer Godden,4.21,1590171241,9781590000000.0,juvenile fiction
12936,Gathering Blue (The Giver  #2),Lois Lowry,3.82,0385732562,9780390000000.0,juvenile fiction
22265,Neptune Noir: Unauthorized Investigations into Veronica Mars,Rob Thomas/Leah Wilson/Heather Havrilesky/Amy Berner/Lynne Edwards/John  Ramos/Alafair Burke/Chris McCubbin/Lawrence Watt-Evans/Lani Diane Rich/Geoff Klock/Judy Fitzwater/Evelyn Vaughn/Joyce Millman/Amanda Ann Klein/Kristen Kidder/Jesse Hassenger/Gwen Ellery/Misty Hook/Samantha Bornemann,3.63,1933771135,9781930000000.0,
3852,Primal Heat (Includes: Breeds  #8.5; Devlin Dynasty  #1; Moon Lust  #1),Lora Leigh/Sherri L. King/Lorie O'Clare/Jaci Burton,4.13,1843607409,9781840000000.0,booksellers and bookselling
42763,A Dracula Handbook,Elizabeth Russell Miller,4.07,1413480942,9781410000000.0,education
26581,Sleeping Beauty Trilogy (Sleeping Beauty  #1-3),A.N. Roquelaure/Anne Rice,3.99,0452156610,9780450000000.0,
1426,Warrior of the Light,Paulo Coelho,3.7,0060527986,9780060000000.0,fiction
11413,Captivating: Unveiling the Mystery of a Woman's Soul,John Eldredge/Stasi Eldredge,3.91,0785264698,9780790000000.0,
17224,The Diamond Color Meditation: Color Pathway to the Soul,John  Diamond,5,1890995525,9781890000000.0,health & fitness
27118,The Roman Empire,Colin      Wells,3.58,0674777700,9780670000000.0,political science
18966,The Silmarillion,J.R.R. Tolkien/Christopher Tolkien,3.92,0261102427,9780260000000.0,fiction
10215,The Far Pavilions,M.M. Kaye,4.21,0517333414,9780520000000.0,fiction
34866,Night of the Fox (Dougal Munro and Jack Carter #1),Jack Higgins,3.92,0671728202,9780670000000.0,fiction
41665,Exile,Blake Nelson/Francine Kass,3.15,0684838389,9780680000000.0,fiction
32980,The Mystery at the Moss-covered Mansion (Nancy Drew Mystery Stories  #18),Carolyn Keene/Russell H. Tandy/Mildred Benson,3.89,1557092648,9781560000000.0,juvenile fiction
41783,Fluffy Humpy Poopy Puppy: A Ruff  Dog-Eared Look at Man's Best Friend,Michael J. Nelson/Pop Ink/Charles S. Anderson Design Company,4,0810970570,9780810000000.0,
21752,The Visitor (Jack Reacher  #4),Lee Child/Hayward Morse,4.09,1860429165,9781860000000.0,fiction
28917,You Can Never Go Home Again,Dyan Sheldon,4.23,081673691X,9780820000000.0,juvenile fiction
39510,The Burglar Who Traded Ted Williams (Bernie Rhodenbarr  #6),Lawrence Block,3.89,0060731443,9780060000000.0,medical
8290,The Deer in the Wood,Laura Ingalls Wilder/Renée Graef,4.17,0064434982,9780060000000.0,juvenile fiction
27038,The Church in Ancient Society: From Galilee to Gregory the Great (History of the Christian Church),Henry Chadwick,4.19,0199265771,9780200000000.0,history
31880,Introduction to the Philosophies of Research and Criticism in Education and the Social Sciences,James   Paul,2.75,0130422533,9780130000000.0,
13930,Foxmask (Saga of the Light Isles  #2),Juliet Marillier,4.1,0330411845,9780330000000.0,
8703,The Restaurant at the End of the Universe (The Hitchhiker's Guide to the Galaxy  #2),Douglas Adams/Martin  Freeman,4.22,0739332074,9780740000000.0,"dent, arthur (fictitious character)"
18852,The Years,Virginia Woolf,3.77,0141185325,9780140000000.0,fiction
32961,The House on Mango Street,Sandra Cisneros,3.63,0739322796,9780740000000.0,fiction
6658,When the Emperor Was Divine,Julie Otsuka,3.73,0141009055,9780140000000.0,fiction
29185,Earth  Air  Fire  Water (Tales from the Eternal Archives  #2),Margaret Weis/Janet Pack/Bruce Holland Rogers/Nina Kiriki Hoffman/Tanya Huff/Linda P. Baker/Michelle Sagara West/Nancy Varian Berberick/Mark A. Garland/Lawrence Schimel/Donald J. Bingle/Jane Lindskold/Kristine Kathryn Rusch/Edward Carmien/Jean-François Podevin/Robyn McGrew/Carrie Channell,3.39,0886778573,9780890000000.0,
15497,Hard Sell,Piers Anthony,3.38,0441317480,9780440000000.0,fiction
38670,Pedro Páramo,Juan Rulfo,4.05,351801434X,9783520000000.0,mexican fiction
23404,Regarding the Fountain: A Tale  in Letters  of Liars and Leaks,Kate Klise/M. Sarah Klise,4.2,0380793474,9780380000000.0,
