bookID,title,authors,average_rating,isbn,isbn13,category
23811,The Silence of the Lambs,Yvonne Tasker,4.27,0851708714,9780850000000.0,
35249,Frankenstein,Mary Wollstonecraft Shelley,3.79,074325578X,9780740000000.0,
7340,The Maps of Tolkien's Middle-earth,Brian Sibley/John  Howe/J.R.R. Tolkien,4.14,061839110X,9780620000000.0,
31114,Homelands: Women’s Journeys Across Race  Place  and Time,Patricia Justine Tumang/Edwidge Danticat/Jenesha de Rivera,4.43,158005188X,9781580000000.0,
12053,The Sheltering Sky,Paul Bowles,3.91,006083482X,9780060000000.0,
11323,Herbert the Timid Dragon,Mercer Mayer,4.62,0307114635,9780310000000.0,
484,Reinventing the Enemy's Language: Contemporary Native Women's Writings of North America,Joy Harjo/Gloria Bird/Beth Cuthand/Valerie Martinez/Patricia Blanco,4.39,0393318281,9780390000000.0,
29173,The Dragons at War (Dragonlance Dragons  #2),Margaret Weis/Tracy Hickman/Adam Lesh,4.02,0786904917,9780790000000.0,
25033,Common Herbs for Natural Health,Juliette De Bairacli Levy/Heather  Wood,4.45,0961462094,9780960000000.0,
33481,Will Eisner Sketchbook,Will Eisner,4.31,1569719608,9781570000000.0,
13012,Julius Caesar,William Shakespeare/SparkNotes,3.68,1586638475,9781590000000.0,
12123,Sierra's Homecoming (McKettricks  #5),Linda Lael Miller,4.09,0373247958,9780370000000.0,
30981,The Kingdom of Shadow (Diablo  #3),Richard A. Knaak,3.93,0743426924,9780740000000.0,
14030,The Dancing Girl of Izu and Other Stories,Yasunari Kawabata/J. Martin Holman,3.78,1887178945,9781890000000.0,
39623,The Cursed One (Wild Wulfs of London  #3),Ronda Thompson,4.02,0312935757,9780310000000.0,
16686,The Fantasies of Robert A. Heinlein,Robert A. Heinlein,3.9,0312875576,9780310000000.0,
22687,No Other Woman (No Other  #2),Shannon Drake,3.78,0380781360,9780380000000.0,
43529,The Au Pairs (The Au Pairs #1),Melissa de la Cruz,3.65,0689873190,9780690000000.0,
16716,The Wall of the Sky  the Wall of the Eye,Jonathan Lethem,3.67,0156032481,9780160000000.0,
35652,The Beatles Diary  Vol 1: From Liverpool to London (Falk Symposium),Keith Badman/Keith Badman,4.56,0711983089,9780710000000.0,
22557,Wasteland of Flint,Thomas Harlan,3.79,0765341131,9780770000000.0,
40281,Masterpieces: The Best Science Fiction of the Twentieth Century,Orson Scott Card/Isaac Asimov/William Gibson/Michael Swanwick/Theodore Sturgeon/Larry Niven/Robert Silverberg/Harry Turtledove/James Blish/George R.R. Martin/James Patrick Kelly/Karen Joy Fowler/Arthur C. Clarke/Lloyd Biggle Jr./Terry Bisson/Poul Anderson/John Kessel/R.A. Lafferty/C.J. Cherryh/Lisa Goldstein/Edmond Hamilton/Robert A. Heinlein/Ursula K. Le Guin/Ray Bradbury/Frederik Pohl/Harlan Ellison/George Alec Effinger/Brian W. Aldiss,4.21,0441011330,9780440000000.0,
35324,Incident at Exeter,John G. Fuller,3.56,0425039293,9780430000000.0,
45267,Doisneau,Peter Hamilton/Robert Doisneau/David    Elliott,4.36,1900826240,9781900000000.0,
29358,Charlie Wilson's War: The Extraordinary Story of How the Wildest Man in Congress and a Rogue CIA Agent Changed the History of our Times,George Crile,4.01,0802141242,9780800000000.0,
26593,Haunted Castle on Hallows Eve (Magic Tree House #30),Mary Pope Osborne/Salvatore Murdocca,4.04,1400091055,9781400000000.0,
35412,The Swarm War (Star Wars: Dark Nest  #3),Troy Denning,3.49,0345463056,9780350000000.0,
35474,Not a Genuine Black Man: Or  How I Claimed My Piece of Ground in the Lily-White Suburbs,Brian Copeland,4.04,1401302335,9781400000000.0,
13832,Young Warriors: Stories of Strength,Tamora Pierce/Josepha Sherman/Margaret Mahy/Lesley McBain/Mike Resnick/Bruce Rogers/Pamela F. Service/Jan Stirling/Holly Black/Doranna Durgin/India Edghill/Rosemary Edghill/Esther M. Friesner/Laura Anne Gilman/Janis Ian/Brett Hartinge,3.91,0375829636,9780380000000.0,
34504,Wyrd Sisters (Discworld  #6; Witches #2),Terry Pratchett,4.13,0061020664,9780060000000.0,
13617,Death Note  Vol. 5: Whiteout (Death Note  #5),Tsugumi Ohba/Takeshi Obata/Alexis Kirsch,4.34,1421506262,9781420000000.0,
19165,Dante Alighieri's Divine Comedy  the Inferno,Dante Alighieri,4,0812034112,9780810000000.0,
25257,Mein Urgroßvater  die Helden und ich,James Krüss,4.3,3551552711,9783550000000.0,
44976,Such a Good Girl and Other Crime Stories,Ed Gorman/Richard Laymon,3.6,0786229985,9780790000000.0,
26439,Absolute C++,Walter J. Savitch,3.83,0321468937,9780320000000.0,
11502,The Gift of Asher Lev,Chaim Potok,4.16,0449001156,9780450000000.0,
26053,Public Secrets,Nora Roberts,4.03,0553589474,9780550000000.0,
24581,The Adventures of Tom Sawyer (Adventures of Tom and Huck  #1),Mark Twain/Scott McKowen,3.91,1402714602,9781400000000.0,
35757,Missing Persons and Mistaken Identities: Women and Gender in Ancient Israel,Phyllis A. Bird,3.8,0800631285,9780800000000.0,
33931,Time's Arrow  Time's Cycle: Myth and Metaphor in the Discovery of Geological Time,Stephen Jay Gould,3.92,0674891996,9780670000000.0,
5907,The Hobbit  or There and Back Again,J.R.R. Tolkien,4.27,0618260307,9780620000000.0,
27432,The Art of the Personal Essay: An Anthology from the Classical Era to the Present,Phillip Lopate,4.19,038542339X,9780390000000.0,
25191,A Personal Matter,Kenzaburō Ōe/John Nathan,3.89,0802150616,9780800000000.0,
16449,Oh My Stars,Lorna Landvik,3.89,0345468368,9780350000000.0,
1241,A Million Little Pieces,James Frey,3.65,0307276902,9780310000000.0,
33824,The Talbot Odyssey,Nelson DeMille,3.85,0751531200,9780750000000.0,
8646,Crow Lake,Mary Lawson,3.88,0385337639,9780390000000.0,
12477,In Cold Blood,Truman Capote,4.07,0141182571,9780140000000.0,
44186,The Monster at the End of this Book,Jon Stone/Michael J. Smollin,4.44,037582913X,9780380000000.0,
40884,Galactic Effectuator,Jack Vance,3.69,0441272320,9780440000000.0,
6851,Mayada  Daughter of Iraq: One Woman's Survival Under Saddam Hussein,Jean Sasson,4,0451212924,9780450000000.0,
1990,Martin Chuzzlewit,Charles Dickens/Patricia Ingham/Hablot Knight Browne,3.83,0140436146,9780140000000.0,
24607,The Painter of Modern Life and Other Essays (Phaidon Arts and Letters),Charles Baudelaire/Jonathon Mayne,3.96,0714833657,9780710000000.0,
30712,The Total Library: Non-Fiction 1922-1986,Jorge Luis Borges/Suzanne Jill Levine/Esther Allen,4.52,0141183020,9780140000000.0,
7437,Naked Lunch,William S. Burroughs/James Grauerholz/Barry Miles,3.46,0802140181,9780800000000.0,
29406,To the Friend who Didn't Save my Life,Hervé Guibert/Linda Cloverdale,3.92,1852423285,9781850000000.0,
37700,Alice's Adventures in Wonderland,Lewis Carroll/Richard  Kelly,4.02,155111223X,9781550000000.0,
14542,The Perfume of the Lady in Black,Gaston Leroux/Margaret Jull Costa/Terry Hale,3.53,1873982984,9781870000000.0,
2071,Freedom Evolves,Daniel C. Dennett,3.83,0142003840,9780140000000.0,
16398,Thank You  Jeeves,P.G. Wodehouse/Jonathan Cecil,4.24,1572704616,9781570000000.0,
9155,Boys or Ballet? (Royal Ballet School Diaries  #8),Alexandra Moss,3.92,0448442515,9780450000000.0,
33993,Citizen Girl,Emma McLaughlin/Nicola Kraus,2.4,0743266862,9780740000000.0,
32994,Maverick: The Success Story Behind the World's Most Unusual Workplace,Ricardo Semler,4.17,0712678867,9780710000000.0,
22277,Kenang-Kenangan Seorang Geisha (Memoirs of a Geisha),Arthur Golden,4.11,9833346685,9789830000000.0,
6066,Robinson Crusoe,Daniel Defoe/L.J. Swingle,3.67,1593080115,9781590000000.0,
8704,Starship Titanic,Terry Jones/Marie-Catherine Caillava,3.6,2290053651,9782290000000.0,
4251,Truth and Fiction in The Da Vinci Code: A Historian Reveals What We Really Know about Jesus  Mary Magdalene & Constantine,Bart D. Ehrman,3.64,0195307135,9780200000000.0,
7089,The Android (Animorphs  #10),K.A. Applegate/Katherine Applegate,3.77,0590997300,9780590000000.0,
27309,The Battle for God: A History of Fundamentalism,Karen Armstrong,3.93,0345391691,9780350000000.0,
28563,Death Of A Blue Movie Star (Rune  #2),Jeffery Deaver,3.53,055358295X,9780550000000.0,
11584,On Writing: A Memoir,Stephen King,4.33,0340820462,9780340000000.0,
21895,The Last Kingdom (The Saxon Stories  #1),Bernard Cornwell/Tom Sellwood,4.25,0792734750,9780790000000.0,
8205,Writings to Young Women on Laura Ingalls Wilder: As Told By Her Family  Friends  and Neighbors (Writings to Young Women on Laura Ingalls Wilder #3),Laura Ingalls Wilder/Stephen W. Hines,3.98,1400307864,9781400000000.0,
8915,A Short History of World War II,James L. Stokesbury,3.95,0688085873,9780690000000.0,
6156,Beloved Bride: The Letters of Stonewall Jackson to His Wife,Bill Potter/Stephen Lang,4.1,1929241631,9781930000000.0,
43582,David Boring,Daniel Clowes,3.81,1594971226,9781590000000.0,
14284,The Beggar Maid: Stories of Flo and Rose,Alice Munro/Susanna Basso,3.93,0679732713,9780680000000.0,
25407,That Same Flower: Floria Aemilia's Letter to St. Augustine,Jostein Gaarder/Anne   Born,3.67,0374253846,9780370000000.0,
415,Gravity's Rainbow,Thomas Pynchon,4.01,0143039946,9780140000000.0,
31186,Patience & Sarah,Isabel Miller/Emma Donoghue,3.9,1551521911,9781550000000.0,
23228,Boy Meets Boy,David Levithan,3.84,0375832998,9780380000000.0,
39690,Good Poems for Hard Times,Garrison Keillor/Charles Bukowski/Robert Burns/Hayden Carruth/Raymond Carver/Billy Collins/Noël Coward/Carl Dennis/E.E. Cummings/Emily Dickinson/Stephen Dobyns/Fleur Adcock/John Donne/Rita Dove/Stephen Dunn/Lawrence Ferlinghetti/Robert Frost/Erica Funkhouser/Donald Hall/Patricia Hampl/Thomas Hardy/Jim Harrison/W.H. Auden/Jennifer Michael Hecht/David Ignatow/John Keats/X.J. Kennedy/Jane Kenyon/Galway Kinnell/Maxine Kumin/Kate Light/Henry Wadsworth Longfellow/Louis MacNeice/Hilaire Belloc/Herman Melville/W.S. Merwin/Edna St. Vincent Millay/Howard Nemerov/Sharon Olds/Mary Oliver/Grace Paley/Lawrence Raab/Kenneth Rexroth/Wendell Berry/Carl Sandburg/John Berryman/Elizabeth Bishop/William Blake/Philip   Booth/Virginia Hamilton Adair/Liesl Mueller,4.14,0143037676,9780140000000.0,
36865,Richard Kern  Action,Richard Kern/Dian Hanson,3.84,3822856495,9783820000000.0,
17280,The Feynman Lectures on Physics Vol 3,Richard P. Feynman/Robert B. Leighton/Matthew L. Sands,4.63,0805390499,9780810000000.0,
4752,A New Hope: The Illustrated Screenplay (Star Wars  Episode IV),George Lucas,4.23,0345420691,9780350000000.0,
15862,Estado De Miedo,Michael Crichton,3.7,9685959757,9789690000000.0,
1441,On Justice  Power and Human Nature: Selections from The History of the Peloponnesian War,Thucydides/Paul Woodruff,3.72,0872201686,9780870000000.0,
19801,Goodbye  Darkness: A Memoir of the Pacific War,William Manchester,4.18,0316501115,9780320000000.0,
44046,Jorge Luis Borges,Nextext/McDougal Publishing Staff,3.5,0618048235,9780620000000.0,
16908,Interrupted Music: The Making of Tolkien's Mythology,Verlyn Flieger,4.21,0873388240,9780870000000.0,
37238,In the Land of the Lawn Weenies and Other Warped and Creepy Tales (Weenies series  #1),David Lubar,3.96,0765345706,9780770000000.0,
11597,The Dark Half,Stephen King,3.77,045052468X,9780450000000.0,
13487,JoJo's Bizarre Adventure  Vol. 6 (Stardust Crusaders  #6),Hirohiko Araki,4.36,1421506556,9781420000000.0,
41193,A Thousand Acres,Jane Smiley,3.81,1400033837,9781400000000.0,
28979,Suffer Little Children (Sister Fidelma  #3),Peter Tremayne,4.05,0451195574,9780450000000.0,
5306,Travels with Charley: In Search of America,John Steinbeck,4.08,0142000701,9780140000000.0,
1937,Little Women,Louisa May Alcott/Jessie Willcox Smith/Frank T. Merrill,4.07,0517221160,9780520000000.0,
3975,Worlds Enough & Time: Five Tales of Speculative Fiction,Dan Simmons,3.75,0060506040,9780060000000.0,
22875,The One Tree (The Second Chronicles of Thomas Covenant  #2),Stephen R. Donaldson,3.98,0345418476,9780350000000.0,
24213,Alice's Adventures in Wonderland & Through the Looking-Glass,Lewis Carroll/John Tenniel/Martin Gardner,4.07,0451527747,9780450000000.0,
13823,Roger Zelazny's To Rule in Amber (The Dawn of Amber  #3),John Gregory Betancourt/Roger Zelazny,3.77,1596871326,9781600000000.0,
7201,As the Crow Flies,Jeffrey Archer,4.1,0312997116,9780310000000.0,
42157,P.S. Longer Letter Later (Elizabeth and Tara*Starr  #1),Paula Danziger/Ann M. Martin,3.78,0590213113,9780590000000.0,
39819,Dogged Pursuit (Jack and Jamie #5),Lee Charles Kelley,3.86,0060732296,9780060000000.0,
32275,River Out of Eden: A Darwinian View of Life,Richard Dawkins/Lalla Ward,3.98,0465069908,9780470000000.0,
29964,A Modern Utopia,H.G. Wells/Gregory Claeys/Francis Wheen,3.45,0141441127,9780140000000.0,
13616,Death Note  Vol. 4: Love (Death Note  #4),Tsugumi Ohba/Alexis Kirsch,4.39,142150331X,9781420000000.0,
18579,Summer of my German Soldier,Bette Greene,3.68,0142406511,9780140000000.0,
29036,The Great Influenza: The Story of the Deadliest Pandemic in History,John M. Barry,3.96,0143036491,9780140000000.0,
2527,The Gospel According to Jesus Christ,José Saramago/Giovanni Pontiero,4.29,0156001411,9780160000000.0,
25061,This Side of Brightness,Colum McCann,3.85,0312421974,9780310000000.0,
8744,Desert Dawn,Waris Dirie/Jeanne D'Haem,3.83,1844080080,9781840000000.0,
35138,The Hour of the Gate (Spellsinger  #2),Alan Dean Foster,3.84,0743498291,9780740000000.0,
100,Simply Beautiful Beading: 53 Quick and Easy Projects,Heidi Boyd,3.78,1581805632,9781580000000.0,
13577,Tsubasa: RESERVoir CHRoNiCLE  Vol. 04 (Tsubasa: RESERVoir CHRoNiCLE  #4),CLAMP/William Flanagan,4.28,034547791X,9780350000000.0,
2906,Bleach―ブリーチ― 1 [Burīchi 1] (Bleach  #1),Tite Kubo,4.22,4088732138,9784090000000.0,
24524,The Final Unfinished Voyage of Jack Aubrey (Aubrey & Maturin #21),Patrick O'Brian/Richard Snow,3.99,039306025X,9780390000000.0,
16803,The Complete Poems and Major Prose,John Milton/Merritt Y. Hughes,4.18,0872206785,9780870000000.0,
2701,The Canterbury Tales (original-spelling edition),Geoffrey Chaucer/Jill Mann,3.49,014042234X,9780140000000.0,
24951,Danny the Champion of the World,Roald Dahl,4.09,0435122215,9780440000000.0,
11880,A Book of Blue Flowers,Robert L. Geneve,3.83,0881927694,9780880000000.0,
8964,Jesus Freaks: Stories of Those Who Stood for Jesus  the Ultimate Jesus Freaks (Jesus Freaks  #1),D.C. Talk/The Voice of the Martyrs,4.21,1577780728,9781580000000.0,
29734,Letting Go,Philip Roth,3.7,0679764178,9780680000000.0,
1337,Enthusiasm and Divine Madness,Josef Pieper/Richard Winston/Clara Winston,4.5,189031823X,9781890000000.0,
31999,鋼之鍊金術師 7,Hiromu Arakawa/荒川弘/方郁仁,4.57,9861146156,9789860000000.0,
44244,The Beleaguered City: The Vicksburg Campaign,Shelby Foote,4.22,0679601708,9780680000000.0,
39636,Twisted (Fearless  #4),Francine Pascal,3.94,0671773453,9780670000000.0,
28419,La Débâcle,Émile Zola/Robert Lethbridge/Elinor Dorday,4.01,0192822896,9780190000000.0,
42300,A Whole Lotta Love,Donna Hill/Francis Ray/Brenda Jackson/Monica Jackson,4.46,0451210905,9780450000000.0,
17697,Collected Shorter Fiction: Volume I,Leo Tolstoy/Aylmer Maude/Nigel J. Cooper,4.41,0375411720,9780380000000.0,
9915,Less Than Zero,Bret Easton Ellis,3.58,0679781498,9780680000000.0,
31819,Harry Potter and Philosophy: If Aristotle Ran Hogwarts,David Baggett/Shawn E. Klein,4.48,0812694554,9780810000000.0,
41592,The Economics of Innocent Fraud: Truth for Our Time,John Kenneth Galbraith,3.6,0618013245,9780620000000.0,
13113,Zen and the Art of Motorcycle Maintenance: An Inquiry Into Values,Robert M. Pirsig,3.77,0688052304,9780690000000.0,
2756,New Media Language,Jean Aitchison/Diana M. Lewis,3,0415283043,9780420000000.0,
45515,Live Rich  Die Broke,Stephen M. Pollan,3.29,1594860165,9781590000000.0,
3867,The History of Love,Nicole Krauss,3.92,0393328627,9780390000000.0,
43620,The Gunslinger,Mary McBride,4.1,0373288565,9780370000000.0,
17945,Everything and Nothing,Jorge Luis Borges/Eliot Weinberger/John M. Fein/James E. Irby/Donald A. Yates,4.38,0811214001,9780810000000.0,
20913,The John Deere Two-Cylinder Tractor Encyclopedia: The Complete Model-by-Model History,Don Macmillan/Wayne G. Broehl Jr.,4.75,076032963X,9780760000000.0,
28564,Bloody River Blues (John Pellam  #2),William Jefferies/Jeffery Deaver,3.49,0671047507,9780670000000.0,
42631,Having a Mary Heart in a Martha World: Finding Intimacy with God in the Busyness of Life,Joanna Weaver,4.18,1578562589,9781580000000.0,
6140,The Moonstone,Wilkie Collins,3.91,0140620133,9780140000000.0,
8706,The Hitchhiker's Guide to the Galaxy (Hitchhiker's Guide to the Galaxy  #1),Douglas Adams,4.22,0330491199,9780330000000.0,
32071,Sons and Lovers,D.H. Lawrence/Geoff Dyer,3.63,0375753737,9780380000000.0,
9735,Ender's Game Boxed Set: Ender's Game  Ender's Shadow  Shadow of the Hegemon,Orson Scott Card,4.49,0765344955,9780770000000.0,
9303,Lucy Sullivan Is Getting Married,Marian Keyes,3.77,0060090375,9780060000000.0,
12069,No More Christian Nice Guy: When Being Nice--Instead of Good--Hurts Men  Women and Children,Paul Coughlin/Laura Schlessinger,3.77,0764200925,9780760000000.0,
31366,Deception on His Mind (Inspector Lynley  #9),Elizabeth  George,4.05,0553575090,9780550000000.0,
28316,Karate Is a Thing of the Spirit,Harry Crews,3.79,068802372X,9780690000000.0,
14865,Vanishing Acts,Jodi Picoult,3.69,0743454553,9780740000000.0,
16999,Fantastic Four  Vol 5: Disassembled,Mark Waid/Paco Medina,3.28,0785115366,9780790000000.0,
26968,Quicksand,Nella Larsen,3.68,0486451402,9780490000000.0,
15216,Sorcery Rising (Fool's Gold  #1),Jude Fisher,3.56,0756401100,9780760000000.0,
29680,The Coen Brothers: Interviews,William Rodney Allen,3.82,1578068894,9781580000000.0,
1334,Lysis/Phaedrus/Symposium: Plato on Homosexuality,Plato/Benjamin Jowett,4.47,0879756322,9780880000000.0,
32155,Cook's Illustrated 2005 (Cook's Illustrated Annuals),Cook's Illustrated Magazine,4.57,0936184922,9780940000000.0,
3738,Typee / Omoo / Mardi,Herman Melville/G. Thomas Tanselle,3.55,0940450003,9780940000000.0,
4742,The Illustrated Art of War,Sun Tzu/Samuel B. Griffith,3.97,019518999X,9780200000000.0,
14719,Your First Year in Network Marketing: Overcome Your Fears  Experience Success  and Achieve Your Dreams!,Mark Yarnell/Rene Reid Yarnell/Richard  Poe,4.04,0761512195,9780760000000.0,
22160,And Then There Were None,Agatha Christie/Hugh Fraser,4.26,1572704497,9781570000000.0,
43884,Phantom (Sword of Truth  #10),Terry Goodkind,3.99,0765305240,9780770000000.0,
41491,Silent Night: The Remarkable Christmas Truce of 1914,Stanley Weintraub,3.6,0684866226,9780680000000.0,
23524,Mythology: The DC Comics Art of Alex Ross,Alex Ross/Geoff Spear/Chip Kidd,4.33,0375714626,9780380000000.0,
14743,The God Delusion,Richard Dawkins,3.9,0618680004,9780620000000.0,
24087,The Eternal Flame (Merlin  #11),T.A. Barron/David Elliot,4.22,0399242139,9780400000000.0,
11136,The Chronicles of Narnia (The Chronicles of Narnia  #1-7),C.S. Lewis/Pauline Baynes,4.26,0060765453,9780060000000.0,
5128,The Doors of Perception & Heaven and Hell,Aldous Huxley,3.92,0060595183,9780060000000.0,
24596,Sebastopol (Images of America: California),Western Sonoma County Historical Society,4.4,0738528528,9780740000000.0,
25102,A Game of You (The Sandman  #5),Neil Gaiman/Shawn McManus/Colleen Doran/Bryan Talbot/George Pratt/Stan Woch/Dick Giordano/Todd Klein,4.43,1563890933,9781560000000.0,
24840,Chimera,John Barth,3.73,0618131701,9780620000000.0,
40042,Always Remember Me: How One Family Survived World War II,Marisabina Russo,4.13,0689869207,9780690000000.0,
28756,The Cheese Monkeys,Chip Kidd,3.75,0060507403,9780060000000.0,
40923,Theodore Rex,Edmund Morris,4.19,0812966007,9780810000000.0,
17275,The Very Best of the Feynman Lectures,Richard P. Feynman,4.18,0465099009,9780470000000.0,
43824,Vittorio the Vampire (New Tales of the Vampires  #2),Anne Rice,3.52,0375401601,9780380000000.0,
11876,Set This House On Fire,William Styron,3.69,009928555X,9780100000000.0,
33561,The Bridegroom,Ha Jin,3.77,0375724931,9780380000000.0,
30855,A Woman in Jerusalem,A.B. Yehoshua/Hillel Halkin,3.43,0151012261,9780150000000.0,
36667,Killing the Imposter God: Philip Pullman's Spiritual Imagination in His Dark Materials,Donna Freitas/Jason Edward King,3.67,0787982377,9780790000000.0,
19634,Who Will Run the Frog Hospital?,Lorrie Moore,3.79,1400033829,9781400000000.0,
37951,Eight Black Horses (87th Precinct  #38),Ed McBain/Mark T. Sullivan,3.92,0743463080,9780740000000.0,
24910,World's Fair,E.L. Doctorow,3.83,0452275725,9780450000000.0,
13442,Night Shift,Stephen King,4,0385129912,9780390000000.0,
432,City of Glass (The New York Trilogy  #1),Paul Auster,3.79,0140097317,9780140000000.0,
33668,4th of July (Women's Murder Club  #4),James Patterson/Maxine Paetro,4.07,0446613363,9780450000000.0,
14055,The Little Friend,Donna Tartt,3.46,0747562113,9780750000000.0,
26407,The Philosophy of Hegel,Georg Wilhelm Friedrich Hegel/Carl Joachim Friedrich,3.37,0075536552,9780080000000.0,
1138,The Warren Buffett CEO: Secrets from the Berkshire Hathaway Managers,Robert P. Miles/Tom Osborne,4.07,0471430455,9780470000000.0,
22739,Le Club de la dernière chance,Marian Keyes,3.81,2266130609,9782270000000.0,
22202,Bravo Two Zero,Andy McNab,4.09,0552153575,9780550000000.0,
11166,Dawn (The Night Trilogy  #2),Elie Wiesel/Frances Frenaye,3.87,0809037726,9780810000000.0,
11666,Rabbit at Rest (Rabbit Angstrom #4),John Updike,3.97,0449911942,9780450000000.0,
27584,Sixty Million Frenchmen Can't Be Wrong,Jean-Benoît Nadeau/Julie Barlow,3.74,1402200455,9781400000000.0,
24583,The Adventures of Tom Sawyer (Adventures of Tom and Huck  #1),Mark Twain/Guy Cardwell/John Seelye,3.91,0143039563,9780140000000.0,
10906,Final Rain (The Survivalist  #19),Jerry Ahern,3.69,0821726846,9780820000000.0,
20679,Advanced Statistics Demystified,Larry J. Stephens,4,0071432426,9780070000000.0,
21753,Echo Burning (Jack Reacher  #5),Lee Child,4.01,1423319524,9781420000000.0,
20381,Shadow Twin,Gardner Dozois/George R.R. Martin/Daniel Abraham,3.57,1596060298,9781600000000.0,
9590,God Bless You  Mr. Rosewater,Kurt Vonnegut Jr.,3.96,0385333471,9780390000000.0,
37572,A Distant Mirror: The Calamitous 14th Century,Barbara W. Tuchman,4.08,0345910907,9780350000000.0,
18808,Dostoevsky,Richard Freeborn,3.76,1904341276,9781900000000.0,
24257,Thus Spoke Zarathustra,Friedrich Nietzsche,4.06,1845882423,9781850000000.0,
24985,Bellwether,Connie Willis,3.92,0553562967,9780550000000.0,
19063,The Book Thief,Markus Zusak/Cao Xuân Việt Khương,4.37,0375831002,9780380000000.0,
20164,Daisy Bates: Civil Rights Crusader from Arkansas,Grif Stockley,3.55,1578068010,9781580000000.0,
28385,In the Shadow of Young Girls in Flower (In Search of Lost Time  #2),Marcel Proust/James Grieve/Christopher Prendergast,4.4,0143039075,9780140000000.0,
41822,The Stars  Like Dust (Galactic Empire  #1),Isaac Asimov,3.74,0553293435,9780550000000.0,
13979,Aerie (Dragon Jousters  #4),Mercedes Lackey,3.95,075640391X,9780760000000.0,
42719,The Van,Roddy Doyle,3.94,043620052X,9780440000000.0,
11752,Lost in the City,Edward P. Jones,4.03,006079528X,9780060000000.0,
8572,Banker,Dick Francis,4.06,0718132386,9780720000000.0,
19764,Corvette: Fifty Years,Randy Leffingwell/David Newhardt,4.06,0760320063,9780760000000.0,
14196,Jonathan Strange y el señor Norrell,Susanna Clarke/Ana María de la Fuente,3.82,8478889736,9788480000000.0,
28004,Cider,Annie Proulx/Lew Nichols,3.64,1580175201,9781580000000.0,
28876,His Majesty's Dragon (Temeraire  #1),Naomi Novik,4.05,0345481283,9780350000000.0,
35499,Side Effects,Amy Goldman Koss,3.87,1596432942,9781600000000.0,
34542,Truckers (Bromeliad Trilogy  #1),Terry Pratchett,3.92,0060094966,9780060000000.0,
22288,Haunted,Chuck Palahniuk,3.59,1400032822,9781400000000.0,
1883,The History of Sexuality  Volume 2: The Use of Pleasure,Michel Foucault/Robert Hurley,4.08,0140137343,9780140000000.0,
31350,Lovelock (Mayflower Trilogy  #1),Orson Scott Card/Kathryn H. Kidd,3.47,031287751X,9780310000000.0,
1462,Euripides I: Alcestis / The Medea / The Heracleidae / Hippolytus,Euripides/Richmond Lattimore/David Grene/Rex Warner/Ralph Gladstone,4.03,0226307808,9780230000000.0,
44128,Blackout (Kat Bronsky #2),John J. Nance,3.96,0330481916,9780330000000.0,
27627,EULIS! The History of Love,Paschal Beverly Randolph,3.85,0766184153,9780770000000.0,
2551,On the Road,Jack Kerouac,3.63,0143036386,9780140000000.0,
27828,Eugene Onegin  Vol. II (Commentary),Alexander Pushkin/Vladimir Nabokov,4.38,0691019045,9780690000000.0,
10517,How to Travel with a Salmon and Other Essays,Umberto Eco/William Weaver,3.85,015600125X,9780160000000.0,
27776,La caída,Albert Camus/Manuel de Lope,4.04,8420637017,9788420000000.0,
43370,Thomas Jefferson: Author of America,Christopher Hitchens,3.91,0060598964,9780060000000.0,
16451,Patty Jane's House of Curl,Lorna Landvik/Mechtild Sandberg-Ciletti/Mechtild Ciletti,3.86,0804114609,9780800000000.0,
11138,Mere Christianity,C.S. Lewis,4.32,0684823780,9780680000000.0,
20417,Have Space Suit—Will Travel,Robert A. Heinlein,3.9,1416505490,9781420000000.0,
17035,Flatland: A Romance of Many Dimensions,Edwin A. Abbott,3.82,1419120026,9781420000000.0,
12263,The Gray-Eyed Goddess (Tales from the Odyssey  #4),Mary Pope Osborne/Troy Howell/Homer,4.09,0786809310,9780790000000.0,
12148,Watership Down,Richard  Adams,4.06,0060935456,9780060000000.0,
44156,The Man Who Wasn't Maigret: A Portrait of Georges Simenon,Patrick Marnham,4.08,0156000598,9780160000000.0,
17319,The Oath (Dismas Hardy  #8),John Lescroart,4.02,0451207645,9780450000000.0,
29613,Codebreakers' Victory: How the Allied Cryptographers Won World War II,Hervie Haufler,4.18,0451209796,9780450000000.0,
18053,Meet Mr. Mulliner,P.G. Wodehouse,4.06,1585672750,9781590000000.0,
45634,The Ice-Shirt (Seven Dreams #1),William T. Vollmann,3.96,0140131965,9780140000000.0,
4341,Dispatch,Bentley Little,3.62,0451216776,9780450000000.0,
3665,Ghosts,John Banville,3.61,0330371851,9780330000000.0,
32115,Ali und Nino,Kurban Said,3.92,3548601316,9783550000000.0,
31196,The Razor's Edge,W. Somerset Maugham,4.19,1400034205,9781400000000.0,
15232,The Lord of the Rings: A Reader's Companion,Wayne G. Hammond/Christina Scull,4.35,0618642676,9780620000000.0,
11535,The Crook Factory,Dan Simmons,3.8,0380789175,9780380000000.0,
1549,Antigone; Oedipus the Kingn; Electra,Sophocles/Edith Hall/H.D.F. Kitto,3.94,0192835882,9780190000000.0,
