bookID,title,authors,average_rating,isbn,isbn13,category
42798,Winter Dreams (Sweet Dreams  #141),Barbara Conklin,3.85,0553270621,9780550000000.0,
17780,In the Heart of the Sea: The Tragedy of the Whaleship Essex,Nathaniel Philbrick,4.16,0141001828,9780140000000.0,
19124,Children of the Star (Children of the Star  #1-3),Sylvia Engdahl,4.24,1892065142,9781890000000.0,
9013,The Long Walk: The True Story of a Trek to Freedom,Sławomir Rawicz,4.21,1592289444,9781590000000.0,
32484,The Necessary Shakespeare,William Shakespeare,4.31,0321272501,9780320000000.0,
26384,Scripta Minora: Hiero/Agesilaus/Constitution of the Lacedaemonians/Ways & Means/Cavalry Commander/Art of Horsemanship/On Hunting/Constitution of the Athenians,Xenophon/Edgar C. Marchant/G.W. Bowersock,4,0674992024,9780670000000.0,
25780,The Two Tocquevilles  Father and Son,R.R. Palmer,2,0691054959,9780690000000.0,
32298,Blame!  Vol. 7,Tsutomu Nihei,4.3,1595328408,9781600000000.0,
7344,Tolkien and C.S. Lewis: The Gift of a Friendship,Colin Duriez,4.01,1587680262,9781590000000.0,
30417,The Killing of Monday Brown,Sandra West Prowell,3.45,0553569694,9780550000000.0,
703,The Plot Against America,Philip Roth,3.77,1400079497,9781400000000.0,
27831,Eugene Onegin,Alexander Pushkin/Tom Beck,4.09,1903517281,9781900000000.0,
12882,Operation Shylock. Ein Bekenntnis,Philip Roth,3.77,3446176934,9783450000000.0,
7393,Sky's Pride and Joy (Bachelor Gulch #8),Sandra Steffen,3.33,0373194862,9780370000000.0,
37329,The Vital Illusion,Jean Baudrillard/Julia Witwer,3.84,0231121008,9780230000000.0,
32686,Legends,Robert Silverberg/Stephen King/Robert Jordan/Terry Goodkind/Anne McCaffrey/Orson Scott Card/Tad Williams/George R.R. Martin/Raymond E. Feist/Terry Pratchett/Ursula K. Le Guin,3.92,0765300354,9780770000000.0,
18488,Frankenstein  or the Modern Prometheus,Mary Wollstonecraft Shelley/Margaret Brantley,3.79,0743487583,9780740000000.0,
45362,The Passion of Jesus Christ,John Piper,4.23,1581346085,9781580000000.0,
44133,The Winter's Tale,William Shakespeare/Susan Snyder/Deborah T. Curren-Aquino,3.7,0521293731,9780520000000.0,
45279,Criptonomicón II: El código Pontifex,Neal Stephenson/Pedro Jorge Romero,4.1,8466616926,9788470000000.0,
36071,First Things First,Stephen R. Covey/A. Roger Merrill/Rebecca R. Merrill,4.1,0684802031,9780680000000.0,
7777,McElligot's Pool,Dr. Seuss,4.06,0394800834,9780390000000.0,
15101,Blackberry Wine,Joanne Harris,3.8,0380815923,9780380000000.0,
32778,The Aeneid,Virgil/Robert Fitzgerald,3.84,0679413359,9780680000000.0,
17488,Five on a Treasure Island (Famous Five  #1),Enid Blyton,4.09,0340796146,9780340000000.0,
23975,Imaginary Friends,Nora Ephron,3.54,1400034221,9781400000000.0,
39671,The Real Frank Zappa Book,Frank Zappa/Peter Occhiogrosso,4.13,0330316257,9780330000000.0,
40364,The Martians (Mars Trilogy  #3.5),Kim Stanley Robinson,3.56,0553574019,9780550000000.0,
4362,Night Draws Near: Iraq's People in the Shadow of America's War,Anthony Shadid,4.12,0312426038,9780310000000.0,
29514,The Lost Continent,Edgar Rice Burroughs,3.68,1600961509,9781600000000.0,
34544,X-Statix  Volume 1: Good Omens,Peter Milligan/Mike Allred/Paul Pope,3.97,0785110593,9780790000000.0,
16963,The Hello  Goodbye Window,Norton Juster/Chris Raschka,3.87,0786809140,9780790000000.0,
23244,Carpe Demon (Demon-Hunting Soccer Mom  #1),Julie Kenner,3.64,0515142212,9780520000000.0,
31304,Nemesis (Miss Marple  #12),Agatha Christie,3.85,0451200187,9780450000000.0,
18564,The Summit (Everest  #3),Gordon Korman,3.96,0439411378,9780440000000.0,
23468,Letters to a Young Artist,Anna Deavere Smith,4.02,1400032385,9781400000000.0,
20076,Maelstrom,Anne McCaffrey/Elizabeth Ann Scarborough,3.88,0345470044,9780350000000.0,
13983,The Wizard of London (Elemental Masters  #4),Mercedes Lackey,3.79,0756403634,9780760000000.0,
17228,Zodiac,Neal Stephenson/Jean-Pierre Pugi,3.72,2207252647,9782210000000.0,
32424,Lightning,Dean Koontz,4.06,0425192032,9780430000000.0,
5396,Dragon's Eye,Christopher Stasheff/William R. Forstchen/Nick DiChario/S.N. Lewitt/Bill Fawcett/Mike Resnick/Mickey Zucker Reichert/S.M. Stirling/Diane Duane/Jody Lynn Nye/Roland J. Green/Teresa Patterson/Judith R. Conly,3.51,0671876090,9780670000000.0,
33440,Lemon Meringue Pie Murder (Hannah Swensen  #4),Joanne Fluke,3.87,0758215045,9780760000000.0,
16914,The Tolkien Fan's Medieval Reader,David E. Smith (Turgon of TheOneRing.net, one of the founding members of this Tolkien website)/Verlyn Flieger/Turgon (=David E. Smith),3.58,1593600119.0,
142,Ruby Ann's Down Home Trailer Park Cookbook,Ruby Ann Boxcar,4.12,0806523492,9780810000000.0,
22392,New X-Men  Volume 7: Here Comes Tomorrow,Grant Morrison/Marc Silvestri,3.75,0785113452,9780790000000.0,
17766,Master and Commander (Aubrey/Maturin Book 1),Patrick O'Brian,4.1,073931565X,9780740000000.0,
34529,Lords and Ladies (Discworld  #14; Witches #4),Terry Pratchett,4.17,055215315X,9780550000000.0,
45595,La Tía Julia y el Escribidor,Mario Vargas Llosa,3.92,8432203238,9788430000000.0,language arts & disciplines
8508,The Jefferson Bible: The Life and Morals of Jesus of Nazareth,Thomas Jefferson,3.82,1557091846,9781560000000.0,religion
38529,Bite Me If You Can (Argeneau #6),Lynsay Sands,4.27,0060774126,9780060000000.0,
10464,Healing With Whole Foods: Asian Traditions and Modern Nutrition,Paul Pitchford,4.41,1556434308,9781560000000.0,health & fitness
15018,Conversations With God: An Uncommon Dialogue  Book 3,Neale Donald Walsch,4.21,1571741038,9781570000000.0,"body, mind & spirit"
25349,The Out-of-Sync Child Has Fun: Activities for Kids with Sensory Processing Disorder,Carol Stock Kranowitz/T.J. Wylie,4.22,0399532714,9780400000000.0,family & relationships
38539,Control Freak (SVH Senior Year  #35),Francine Pascal,3.33,0553493841,9780550000000.0,
22380,JLA: Tierra 2,Grant Morrison/Frank Quitely/Rafael De la Iglesia,3.97,987224975X,9789870000000.0,
100,Simply Beautiful Beading: 53 Quick and Easy Projects,Heidi Boyd,3.78,1581805632,9781580000000.0,beads
41861,John  Paul  George & Ben,Lane Smith,4.21,0786848936,9780790000000.0,civil rights
19802,A World Lit Only by Fire: The Medieval Mind and the Renaissance: Portrait of an Age,William Manchester,3.85,0316545562,9780320000000.0,history
23010,Prisoner's Dilemma,Richard Powers,3.87,0060977086,9780060000000.0,fiction
9475,Midnight for Charlie Bone (The Children of the Red King  #1),Jenny Nimmo,3.82,0439474299,9780440000000.0,juvenile fiction
19983,The Drift House: The First Voyage,Dale Peck,3.65,159990005X,9781600000000.0,juvenile fiction
33455,Island of the Sequined Love Nun,Christopher Moore,3.8,0060735449,9780060000000.0,fiction
5230,Vergeef me,Wally Lamb/Inge de Heer,4.18,9022530078,9789020000000.0,fiction
14721,The Wealth of Networks: How Social Production Transforms Markets and Freedom,Yochai Benkler,3.97,0300110561,9780300000000.0,business & economics
30241,Bloody Bones (Anita Blake  Vampire Hunter #5),Laurell K. Hamilton,4.11,0425205673,9780430000000.0,fiction
37305,Destiny's Daughters,Gwynne Forster/Donna Hill/Parry A. Brown,4.2,0758212380,9780760000000.0,
41781,Love Sick: A Smoldering Look at Love  Lust  and Marriage,Michael J. Nelson/Charles S. Anderson Design Company/Pop Ink,3.76,0810957906,9780810000000.0,
5420,'Salem's Lot,Stephen King,4.02,0340770538,9780340000000.0,fiction
18902,Book of Nightmares (Diadem  Worlds of Magic  #6),John Peel,4.12,0738706124,9780740000000.0,philosophy
28543,Dragonsong (Pern: Harper Hall  #1),Anne McCaffrey,4.24,0553120441,9780550000000.0,fiction
5198,Paradise,Toni Morrison,3.8,0452280397,9780450000000.0,fiction
668,We the Living,Ayn Rand/Leonard Peikoff,3.91,0451187849,9780450000000.0,philosophy
19108,Dead Souls,Nikolai Gogol/Richard Pevear/Larissa Volokhonsky,3.99,1400043190,9781400000000.0,fiction
1525,The Oresteia,Aeschylus/Ted Hughes,4.02,0374527059,9780370000000.0,drama
251,Nexus (The Rosy Crucifixion  #3),Henry Miller,4.1,0802151787,9780800000000.0,fiction
37530,Erotism: Death and Sensuality,Georges Bataille/Mary Dalwood,4.11,0872861902,9780870000000.0,
27295,Three Greek Plays: Prometheus Bound/Agamemnon/The Trojan Women,Euripides/Aeschylus/Edith Hamilton,4.06,0393002039,9780390000000.0,drama
41903,Das Zauberer-Handbuch - Die Magische Welt der Joanne K. Rowling von A bis Z,Allan Zola Kronzek,4.04,3442451531,9783440000000.0,
10662,The Ends of the Earth: A Journey to the Frontiers of Anarchy,Robert D. Kaplan,4.12,0679751238,9780680000000.0,travel
28003,Heart Songs and Other Stories,Annie Proulx,3.94,0020360754,9780020000000.0,fiction
3638,The Wish Giver: Three Tales of Coven Tree,Bill Brittain/Andrew Glass,3.83,0064401685,9780060000000.0,juvenile fiction
1846,Wild at Heart: Discovering the Secret of a Man's Soul,John Eldredge,3.92,0785268839,9780790000000.0,
31482,Sunny The Yellow Fairy (Rainbow Magic  #3),Daisy Meadows/Georgie Ripper,3.82,0439744660,9780440000000.0,language arts & disciplines
15045,Tanglewreck,Jeanette Winterson,3.46,1582349193,9781580000000.0,juvenile fiction
12117,One  No One and One Hundred Thousand,Luigi Pirandello/William Weaver/Samuel Putnam,4.1,0941419746,9780940000000.0,drama
2887,Death Note  Vol. 3: 激走 (Death Note  #3),Tsugumi Ohba/Takeshi Obata,4.43,4088736524,9784090000000.0,
33978,ER Vets: Life in an Animal Emergency Room,Donna M. Jackson,3.91,0618436634,9780620000000.0,"beresford, tommy (fictitious character)"
27689,Mary Stewart's Merlin Trilogy (Arthurian Saga  #1-3),Mary  Stewart,4.39,0688003478,9780690000000.0,fiction
6200,Youth,J.M. Coetzee,3.79,0142002003,9780140000000.0,biography & autobiography
28205,Vulcan's Forge (Philip Mercer  #1),Jack Du Brul,3.99,0451412109,9780450000000.0,fiction
8951,The Lake of Souls (Cirque du Freak #10),Darren Shan,4.18,0316016659,9780320000000.0,juvenile fiction
17181,CliffsNotes on Faulkner's The Sound and the Fury (Cliffs Notes),James Lamar Roberts/William Faulkner/CliffsNotes,3.74,0822012197,9780820000000.0,
40223,Kushiel's Avatar (Phèdre's Trilogy  #3),Jacqueline Carey,4.36,1405034149,9781410000000.0,fiction
8799,Ahora sabréis lo que es correr,Dave Eggers/María Victoria Alonso Blanco,3.63,8439710097,9788440000000.0,fiction
33931,Time's Arrow  Time's Cycle: Myth and Metaphor in the Discovery of Geological Time,Stephen Jay Gould,3.92,0674891996,9780670000000.0,science
44815,Un amour de swann (À la recherche du temps perdu  #1.2),Marcel Proust,3.92,2035882133,9782040000000.0,language arts & disciplines
44208,The Frog King,Frank McConnell,3.6,0802757480,9780800000000.0,games & activities
25956,Essential McLuhan,Marshall McLuhan/Eric McLuhan/Frank Zingrone,4.05,0415162459,9780420000000.0,mass media
17803,After Dark,Haruki Murakami/Jay Rubin,3.7,0307265838,9780310000000.0,fiction
28645,You Shall Know Our Velocity,Dave Eggers,3.63,0141013451,9780140000000.0,fiction
16690,The Moon is a Harsh Mistress,Robert A. Heinlein,4.17,0340837942,9780340000000.0,fiction
42512,We Were Soldiers Once... and Young: Ia Drang - The Battle that Changed the War in Vietnam,Harold G. Moore/Joseph L. Galloway,4.31,034547581X,9780350000000.0,history
18431,The Rule of Four,Ian Caldwell/Dustin Thomason,3.23,0440241359,9780440000000.0,fiction
30044,Young Men and Fire,Norman Maclean,4.08,0226500624,9780230000000.0,history
13570,Tsubasa: RESERVoir CHRoNiCLE  Vol. 1,CLAMP/Anthony Gerard,4.11,0345470575,9780350000000.0,
9517,Persepolis 2: The Story of a Return (Persepolis  #2),Marjane Satrapi/Anjali Singh,4.24,0375714669,9780380000000.0,"comic books, strips, etc"
36064,American Tabloid (Underworld USA #1),James Ellroy,4.21,037572737X,9780380000000.0,fiction
27368,Letters from the Bay of Islands: The Story of Marianne Williams,Marianne Williams/Caroline Fitzgerald,3.72,0143019295,9780140000000.0,
10414,Do Not Open This Book,Michaela Muntean/Pascal Lemaître,3.9,0439698391,9780440000000.0,juvenile fiction
32154,The Best American Classics,Cook's Illustrated Magazine/John  Burgoyne,4.14,1933615036,9781930000000.0,
12993,Hamlet  The Texts of 1603 and 1623,William Shakespeare/Neil Taylor,4.27,1904271553,9781900000000.0,
29720,Doubling the Point: Essays and Interviews,J.M. Coetzee/David Attwell,4.05,0674215184,9780670000000.0,history
26522,Three Plays of Euripides: Alcestis/Medea/The Bacchae,Euripides/Paul Roche,3.97,0393093123,9780390000000.0,history
43958,Apologia Pro Vita Sua (A Defense of One's Life),John Henry Newman,4.12,0486442136,9780490000000.0,
8908,World War Z: An Oral History of the Zombie War,Max Brooks,4.01,0307346609,9780310000000.0,fiction
29737,My Life as a Man,Philip Roth,3.73,067974827X,9780680000000.0,fiction
33194,Romeo and Juliet,William Shakespeare/G. Blakemore Evans/Thomas Moisan,3.74,0521532531,9780520000000.0,literary collections
3067,The Complete Stories,Bernard Malamud/Robert Giroux,4.22,0374525757,9780370000000.0,fiction
41489,Deck the Halls,Mary Higgins Clark/Carol Higgins Clark,3.61,0743418131,9780740000000.0,fiction
8298,The Little House Cookbook: Frontier Foods from Laura Ingalls Wilder's Classic Stories,Barbara M. Walker/Garth Williams,4.15,0064460908,9780060000000.0,cooking
17795,Banvard's Folly: Thirteen Tales of People Who Didn't Change the World,Paul  Collins,3.98,0312300336,9780310000000.0,
34199,The I Ching or Book of Changes,Richard Wilhelm/Cary F. Baynes/C.G. Jung,4.19,0140192077,9780140000000.0,
19323,Tale of Peter Rabbit,Beatrix Potter,4.18,0723249865,9780720000000.0,juvenile fiction
15375,The Diviners,Rick Moody,3.03,0316013277,9780320000000.0,fiction
17730,House of Mirth,Edith Wharton,3.95,1600962203,9781600000000.0,
2811,A House Like a Lotus (O'Keefe Family  #3),Madeleine L'Engle,3.76,0440936853,9780440000000.0,fiction
3420,Morgan's Run,Colleen McCullough,3.95,0671024183,9780670000000.0,fiction
12083,Long Day's Journey into Night,Eugene O'Neill/Harold Bloom,4.07,0300093055,9780300000000.0,religion
45234,The Gun Seller,Hugh Laurie,3.68,067102082X,9780670000000.0,fiction
3051,Sir Gawain and the Green Knight,Selina Shirley Hastings/Juan Wijngaard,3.91,0744520053,9780740000000.0,juvenile fiction
15859,Unnatural Exposure (Kay Scarpetta  #8),Patricia Cornwell,4.06,0425163407,9780430000000.0,fiction
21494,Floaters,Joseph Wambaugh,3.52,0553575953,9780550000000.0,fiction
4588,Extremely Loud and Incredibly Close,Jonathan Safran Foer,3.98,0618711651,9780620000000.0,fiction
5901,The 9/11 Commission Report: Final Report of the National Commission on Terrorist Attacks Upon the United States,National Commission on Terrorist Attacks Upon The United States,3.6,0393060411,9780390000000.0,history
29906,The Collected Dialogues,Plato/Edith Hamilton/Huntington Cairns,4.23,0691097186,9780690000000.0,philosophy
38678,Peter Pan,J.M. Barrie/Tim Curry,4.08,0743564529,9780740000000.0,drama
7581,The Book of Awakening: Having the Life You Want by Being Present to the Life You Have,Mark Nepo,4.31,1573241172,645241001173.0,self-help
39315,Katie's Big Move (Junior Gymnasts  #2),Teddy Slater/Wayne Alfano,3.75,0590859986,9780590000000.0,gymnastics
16387,Carry On  Jeeves (Jeeves  #3),P.G. Wodehouse,4.27,1585673927,9781590000000.0,england
8745,Desert Flower,Waris Dirie/Cathleen Miller,4.15,0688172377,9780690000000.0,
31466,Far from the Madding Crowd,Thomas Hardy,3.94,0140620478,9780140000000.0,
23512,Astronomy Today,Eric Chaisson/Steve McMillan,3.99,0131445960,9780130000000.0,science
7656,Fahrenheit 451,Ray Bradbury,3.99,8445074873,9788450000000.0,book burning
35124,Mid-Flinx (Pip & Flinx #7),Alan Dean Foster,3.94,0345406443,9780350000000.0,fiction
41538,The Living Blood (African Immortals  #2),Tananarive Due,4.34,0671040847,9780670000000.0,fiction
37594,The Eternity Code (Artemis Fowl  #3),Eoin Colfer,4.04,0439573882,9780440000000.0,
23235,Where We Are  What We See: The Best Young Writers and Artists in America,David Levithan,3.76,0439736463,9780440000000.0,
32695,El talismán,Stephen King/Peter Straub/Pilar Giralt Gorina,4.13,8408042432,9788410000000.0,
10910,Mercy,Jodi Picoult,3.58,0743422449,9780740000000.0,fiction
5171,Drowning Ruth,Christina Schwarz,3.74,0345439104,9780350000000.0,fiction
37558,Sense and Sensibility,Jane Austen/Laura Engel,4.07,159308336X,9781590000000.0,
22292,Haunted,Chuck Palahniuk/Erik Darling/Arthur Morey/Scott Brick/Lorna Raver/Marc Cashman/Kimberly Farr/Renee Randman,3.59,0739302868,9780740000000.0,
32256,Call After Midnight & Under The Knife,Tess Gerritsen,3.99,037377172X,9780370000000.0,fiction
45442,La venganza de Opal (Artemis Fowl  #4),Eoin Colfer/Ana Alcaina,4.05,0307344673,9780310000000.0,juvenile fiction
31303,At Bertram's Hotel,Agatha Christie,3.7,0451199936,9780450000000.0,
10061,Flags of Our Fathers: A Young People's Edition,Michael R. French/Ron Powers/James D. Bradley,4.17,0440229200,9780440000000.0,
15330,The Return of the King (The Lord of the Rings  #3),Brian Sibley/J.R.R. Tolkien,4.35,0563536594,9780560000000.0,song cycles
14886,Die Hexen von Salem Falls,Jodi Picoult,3.82,3822505870,9783820000000.0,fiction
15827,National Geographic Field Guide to the Birds of North America,National Geographic Society/Jon L. Dunn/Jonathan Alderfer,4.38,0792253140,9780790000000.0,nature
14926,Emma,Jane Austen/James Kinsley/Adela Pinch,4,0192802372,9780190000000.0,fiction
36570,The Devil's Waltz,Anne Stuart,3.74,0778322734,9780780000000.0,historical fiction
14658,Encyclopedia Brown and the Case of the Treasure Hunt (Encyclopedia Brown  #17),Donald J. Sobol/Gail Owens,4.03,0553156500,9780550000000.0,juvenile fiction
20519,What Would Machiavelli Do?: The Ends Justify the Meanness,Stanley Bing,3.45,0066620104,9780070000000.0,biography & autobiography
12442,The Plague Dogs,Richard  Adams,3.85,0345494024,9780350000000.0,fiction
22225,The Princess Bride (Long  Tall Texans  #15),Diana Palmer,3.89,0373192827,9780370000000.0,comics & graphic novels
38538,Forbidden Love (Sweet Valley High #34),Francine Pascal/Kate William,3.32,0553275216,9780550000000.0,large type books
18576,Everything on a Waffle (Coal Harbour #1),Polly Horvath,3.72,0374422087,9780370000000.0,juvenile fiction
7332,The Silmarillion,J.R.R. Tolkien/Christopher Tolkien/Ted Nasmith,3.92,0618391118,9780620000000.0,fiction
5402,"Stand Back  Said the Elephant  ""I'm Going to Sneeze!""",Patricia Thomas/Wallace Tripp,4.39,0688093388,9780690000000.0,
2123,The 36-Hour Day: A Family Guide to Caring for Persons with Alzheimer Disease  Related Dementing Illnesses  and Memory Loss in Later Life,Nancy L. Mace/Peter V. Rabins,4.24,0446618764,9780450000000.0,family & relationships
4625,The Complete Short Stories of Ernest Hemingway,Ernest Hemingway/John Hemingway/Patrick Hemingway/Gregory H. Hemingway/Charles Scribner Jr.,4.29,0684843323,9780680000000.0,fiction
42410,The Easter Rabbit's Parade,Lois Lenski,3,037582748X,9780380000000.0,
30681,Thumbsucker,Walter Kirn,3.44,0385497091,9780390000000.0,fiction
22994,Selected Verse,Federico García Lorca/Christopher Maurer,4.43,0374528551,9780370000000.0,poetry
24517,The Stuffed Owl: An Anthology of Bad Verse,D.B. Wyndham-Lewis/Charles  Lee/Billy Collins/Max Beerbohm,3.73,1590170385,9781590000000.0,bathetic poetry
35292,Jimmy Stewart: Bomber Pilot,Starr Smith/Walter Cronkite,3.93,0760328242,9780760000000.0,jimmy stewart
42738,The Snapper,Roddy Doyle,3.93,3596153034,9783600000000.0,fiction
5359,The Client,John Grisham,4,0385339089,9780390000000.0,fiction
13575,Tsubasa: RESERVoir CHRoNiCLE  Vol. 8,CLAMP/William Flanagan,4.27,0345484282,9780350000000.0,
31208,Clarissa  Or The History of a Young Lady,Samuel Richardson/Sheila Ortiz Taylor,3.37,0451529790,9780450000000.0,
22575,Sit  Walk  Stand,Watchman Nee,4.42,0842358935,9780840000000.0,fiction
25809,The Ring Bearer,Laura Godwin/John Wallace,3.44,078685510X,9780790000000.0,juvenile fiction
7975,High Rhulain (Redwall  #18),Brian Jacques/David Elliot,4.12,0399242082,9780400000000.0,juvenile fiction
27511,The Commanders,Bob Woodward,3.71,0743234758,9780740000000.0,history
2804,Passionate Minds,David Bodanis,4.1,0307237206,9780310000000.0,science
33718,The Ties That Bind: Life's Most Essential Knots and Ties,Susan Oliver/Harry   Bates,3.67,1584793821,9781580000000.0,
30580,Cancer Ward,Aleksandr Solzhenitsyn/Nicholas Bethell/David Burg,4.21,0679601635,9780680000000.0,fiction
5863,V.S. Naipaul,Bruce Alvin King,2,1403904561,9781400000000.0,literary criticism
22121,Imperial Life in the Emerald City: Inside Iraq's Green Zone,Rajiv Chandrasekaran,4.02,1400044871,9781400000000.0,
12770,A Kiss Before Dying,Ira Levin/Otto Penzler,3.94,0786711647,9780790000000.0,fiction
29052,Marijuana Horticulture: The Indoor/Outdoor Medical Grower's Bible,Jorge Cervantes,4.39,187882323X,9781880000000.0,gardening
11605,Riding the Bullet,Stephen King/Josh Hamilton,3.63,0743525876,9780740000000.0,fiction
30949,The Rise of Christianity : A Sociologist Reconsiders History,Rodney Stark,4.04,0691027498,9780690000000.0,history
18631,Feersum Endjinn,Iain M. Banks,3.82,0553374591,9780550000000.0,fiction
19399,The Unmasking of Oscar Wilde,Joseph Pearce,4.25,1586170260,9781590000000.0,social science
43072,A Picture Book of Anne Frank,David A. Adler/Karen Ritz,4.18,0823410781,9780820000000.0,juvenile nonfiction
42010,Mixed Doubles,Jill Mansell,3.71,0747257353,9780750000000.0,fiction
8813,Clockwork Orange,Anthony Burgess,3.99,345316413X,9783450000000.0,fiction
17214,Starship Troopers,Robert A. Heinlein,4.01,0441783589,9780440000000.0,fiction
33795,Caucasia,Danzy Senna,4.03,1573227161,9781570000000.0,fiction
42001,Falling for You,Jill Mansell,3.8,0755304853,9780760000000.0,fiction
16427,Dead Man's Folly (Hercule Poirot  #33),Agatha Christie,3.79,0007121075,9780010000000.0,detective and mystery stories
33365,A Feather on the Breath of God,Sigrid Nunez,3.91,0312422733,9780310000000.0,fiction
32184,Thanksgiving on Thursday (Magic Tree House  #27),Mary Pope Osborne/Salvatore Murdocca,3.85,0375806156,9780380000000.0,juvenile fiction
11324,Under the Net,Iris Murdoch,3.77,0140014454,9780140000000.0,english fiction
23837,Healing Therapies for Overcoming Insomnia,Peter  Van Houten/Rich McCord,3.6,1565891740,798499100096.0,
2430,The List,Steve Martini,3.96,0515121495,9780520000000.0,fiction
5853,Half a Life,V.S. Naipaul,3.25,037570728X,9780380000000.0,fiction
20941,The Western Canon: The Books and School of the Ages,Harold Bloom,3.86,1573225142,9781570000000.0,literary criticism
30893,The Eiger Sanction (Jonathan Hemlock  #1),Trevanian,4.06,1400098025,9781400000000.0,feature films
38379,Ring (Ring  #1),Kōji Suzuki/Robert B. Rohmer/Glynne Walley,3.82,1932234411,9781930000000.0,detective and mystery stories
8227,Winter Days in the Big Woods,Laura Ingalls Wilder/Renée Graef,4.28,0064433730,9780060000000.0,juvenile fiction
4069,Man's Search for Meaning,Viktor E. Frankl/Harold S. Kushner/William J. Winslade/Isle Lasch,4.36,080701429X,9780810000000.0,
17018,Notes on a Scandal,Zoë Heller,3.71,0141012250,9780140000000.0,fiction
21538,The Closers (Harry Bosch  #11; Harry Bosch Universe  #14),Michael Connelly/Len Cariou,4.13,1594830207,9781590000000.0,fiction
37683,Fahrenheit 451,Ray Bradbury/Alfredo Crespo,3.99,8497930053,9788500000000.0,architecture
4525,Ruby for Rails: Ruby Techniques for Rails Developers,David A. Black/David Heinemeier Hansson,3.77,1932394699,9781930000000.0,computers
4605,Moo,Jane Smiley,3.46,2743604913,9782740000000.0,fiction
23558,Awake in the Dark: The Best of Roger Ebert,Roger Ebert/David Bordwell,4.2,0226182002,9780230000000.0,language arts & disciplines
18533,Doctor Faustus and Other Plays,Christopher Marlowe/Eric Rasmussen/David Bevington,3.98,0192834452,9780190000000.0,drama
24220,Alice's Adventures in Wonderland and Through the Looking-Glass (Alice's Adventures in Wonderland  #1-2),Lewis Carroll/Hugh Haughton/John Tenniel,4.07,0141439769,9780140000000.0,"body, mind & spirit"
24273,Skellig: The Play,David Almond,3.61,0340854332,9780340000000.0,friendship
24079,Casino Royale (James Bond  #1),Ian Fleming,3.73,0340425679,9780340000000.0,
6418,Thanksgiving,Janet Evanovich,3.6,0060598808,9780060000000.0,fiction
39382,Corvette,Jerry Burton,4.83,0883631210,9780880000000.0,corvette automobile
19859,The Best of the Realms: The Stories of Elaine Cunningham (Forgotten Realms: The Best of the Realms  #3),Elaine Cunningham,3.98,0786942886,9780790000000.0,philosophy
29,The Mother Tongue: English and How It Got That Way,Bill Bryson,3.93,0380715430,9780380000000.0,study aids
39309,The Damned (Vampire Huntress  #6),L.A. Banks,4.28,0312934432,9780310000000.0,fiction
30697,Crazy Lady!,Jane Leslie Conly,3.64,0064405710,9780060000000.0,juvenile fiction
12346,Premières Histoires,João Guimarães Rosa,4.33,2864240157,9782860000000.0,
1337,Enthusiasm and Divine Madness,Josef Pieper/Richard Winston/Clara Winston,4.5,189031823X,9781890000000.0,philosophy
37660,American Tragedy: Kennedy  Johnson  and the Origins of the Vietnam War,David E. Kaiser,3.51,0674006720,9780670000000.0,
41713,The Sea Hunters II (The Sea Hunters  #2),Clive Cussler/Craig Dirgo,3.85,0425193721,9780430000000.0,"world war, 1939-1945"
39173,Breaking Free from Compulsive Eating,Geneen Roth,4.01,0452270847,9780450000000.0,self-help
28385,In the Shadow of Young Girls in Flower (In Search of Lost Time  #2),Marcel Proust/James Grieve/Christopher Prendergast,4.4,0143039075,9780140000000.0,england
13492,Jojo's Bizarre Adventure  Tome 4: Dans la salle du dragon à deux têtes (Phantom Blood  #4),Hirohiko Araki,3.97,2290318043,9782290000000.0,
17315,Oath of Swords (War God  #1),David Weber,4.01,1416520864,9781420000000.0,fiction
16593,The Coming of the Fairies,Arthur Conan Doyle/John M. Lynch,3.39,0803266553,9780800000000.0,
14768,Los diarios de Nanny,Emma McLaughlin/Nicola Kraus,3.42,8420465607,9788420000000.0,fiction
40718,The Sorrows of Empire: Militarism  Secrecy  and the End of the Republic,Chalmers Johnson/Shara Kay,4.13,0805077979,9780810000000.0,
17295,Birthday Machine (Disney's Little Einsteins Early Reader),Susan Ring/Anna Okabe,4.29,0786849711,9780790000000.0,
7482,Human Traces,Sebastian Faulks,3.63,0099458268,9780100000000.0,fiction
10796,A Farewell to Arms,Ernest Hemingway/John Slattery,3.8,0743564375,9780740000000.0,
